{
  "$schema": "./schemas/product-status.schema.json",
  "schemaVersion": "1.0",
  "snapshot": {
    "date": "2026-09-28",
    "lastVerifiedCommit": "410e11b9bc2d3eff477215bbd0040f00a19abc43",
    "policy": "Only code, automated checks, and evidence tied to a commit can promote a gate."
  },
  "product": {
    "id": "dev.copperbench.studio",
    "name": "Copperbench",
    "version": "0.1.10",
    "stage": 17,
    "channel": "stable",
    "targetPlatforms": ["windows-11-x64", "ubuntu-24.04-x86_64"],
    "license": "GPL-3.0-only",
    "additionalTerms": "LICENSE-ADDITIONAL-TERMS.md",
    "betaEligible": true
  },
  "delivery": {
    "p263CandidateQualification": {
      "date": "2026-10-14",
      "status": "reviewed-scoped-candidates",
      "formalSupportClaim": false,
      "published": false,
      "scopes": [
        "fabric:G2:windows",
        "neoforge:G2:windows",
        "fabric:G2:ubuntu",
        "neoforge:G2:ubuntu"
      ],
      "report": "docs/testing/p263-closeout-2026-10-14.md",
      "releaseNotes": "docs/releases/copperbench-26-3-candidate-2026-10-14.md",
      "manifest": "evidence/p263/2026-10-14/qualification.json",
      "limitations": "Exact frozen candidates only. Ubuntu combines separately validated installation/client pairs. Public release, historical gates and eight published generator declarations are unchanged."
    },
    "stableRelease": {
      "tag": "v0.1.10",
      "linuxTag": "v0.1.9-linux-stable",
      "status": "ready",
      "linuxStatus": "public-stable",
      "decision": "approved",
      "decisionDate": "2026-10-18",
      "scope": "Requested Windows 0.1.10 release for component updates, localized startup/dialogs, desktop motion, native outer-window rounding and unified branding. Focused source checks and a complete-payload file lifecycle rehearsal passed; final-main CI and public release packaging are pending. Linux remains public at 0.1.9; historical installed-product and gameplay evidence retains its original source/binary scope.",
      "sourcePolicy": "Signed latest-main tags, protected build/promotion workflows, source provenance and exact asset hashes remain required. Historical gates keep their original source and binary scope.",
      "developmentEvidence": "docs/testing/maintenance-release-0.1.10.md",
      "integrationReport": "docs/testing/maintenance-release-0.1.10.md",
      "previousReleaseState": "evidence/maintenance/2026-10-18/display-brand-0110/previous-release-state.json",
      "sourceVerification": {
        "requiredCi": {
          "status": "pending"
        },
        "documentation": {
          "status": "pending"
        },
        "installedPackageAcceptance": "pending-final-public-package",
        "fullGameplayAcceptance": "not-repeated",
        "localCandidate": {
          "sourceCommit": "4f6335e15875d5ba7b2dc5f67861b7a20352168f",
          "verification": "evidence/maintenance/2026-10-18/display-brand-0110/verification.json",
          "scope": "Focused source checks, final installer icon validation and complete-payload file lifecycle; no OS registration or application/game launch in that rehearsal"
        }
      }
    },
    "linuxMaintenanceRelease": {
      "tag": "v0.1.9-linux-stable",
      "status": "public-stable",
      "candidateSourceCommit": "9e8fcda24e58d165cb2b767f3a0cb3092a7f527c",
      "candidateWorkflowRunId": "38894781422",
      "acceptancePolicy": "maintenance-ci-0.1.9",
      "formalSupportClaim": false,
      "fullInstalledAcceptance": "not-repeated",
      "integrationReport": "docs/testing/maintenance-release-0.1.9.md",
      "releaseCommit": "474b2df4c52ecf52e1f3724448c2d12c8af85396",
      "releaseUrl": "https://github.com/Lotulune/Copperbench/releases/tag/v0.1.9-linux-stable",
      "publishedAt": "2026-10-16T12:49:41Z",
      "releaseWorkflowRun": "https://github.com/Lotulune/Copperbench/actions/runs/38902713886",
      "releaseWorkflowConclusion": "success",
      "assetProof": "evidence/maintenance/2026-10-16/publication-0.1.9/linux/linux-public-verification.json",
      "cloudAutomatedAcceptance": {
        "status": "passed",
        "run": "https://github.com/Lotulune/Copperbench/actions/runs/38903643192",
        "scope": "Ubuntu Setup and DEB automated lifecycle/Native checks; full GNOME desktop/player certification not repeated"
      }
    },
    "linuxRelease": {
      "tag": "v0.1.2-linux-stable",
      "status": "public-stable",
      "channel": "stable",
      "stage": 17,
      "stageStatus": "complete",
      "formalSupportClaim": true,
      "releaseCommit": "410e11b9bc2d3eff477215bbd0040f00a19abc43",
      "binarySourceCommit": "9bc6d104688c24512468880abdc2a96828fcaab8",
      "releaseWorkflowRun": "https://github.com/Lotulune/Copperbench/actions/runs/36352554854",
      "releaseUrl": "https://github.com/Lotulune/Copperbench/releases/tag/v0.1.2-linux-stable",
      "supportRecord": "release-control/linux-platform-support.json",
      "scope": {
        "distribution": "Ubuntu",
        "version": "24.04 LTS",
        "architecture": "x86_64",
        "desktop": "GNOME",
        "sessions": [
          "wayland",
          "x11"
        ],
        "installedRuntimeTracks": [
          "fabric-1.21.1",
          "neoforge-1.21.1"
        ],
        "otherDistributionsCertified": false,
        "otherArchitecturesCertified": false
      },
      "assets": {
        "deb": {
          "role": "deb",
          "name": "copperbench_0.1.2_amd64.deb",
          "mediaType": "application/vnd.debian.binary-package",
          "size": 888622228,
          "sha256": "fd43bd23926a2f37042f14d6a65a7d606b59b08035a92d490ff5ded156931aef"
        },
        "portable": {
          "role": "portable",
          "name": "Copperbench.0.1.2.Linux.x86_64.tar.gz",
          "mediaType": "application/gzip",
          "size": 968869856,
          "sha256": "14576bfafd24cf773b689fecb448aa7dd2f78cf05fd80e79c25eefe874e408fa",
          "candidateName": "Copperbench 0.1.2 Linux x86_64.tar.gz"
        }
      }
    },
    "publishedBaseline": {
      "tag": "v0.1.2",
      "sourceCommit": "410e11b9bc2d3eff477215bbd0040f00a19abc43",
      "status": "public-stable",
      "releaseWorkflowRun": "https://github.com/Lotulune/Copperbench/actions/runs/36352304576"
    },
    "releaseContract": {
      "tag": "v0.1.9",
      "purpose": "cloud-export-regression-maintenance-release",
      "sourcePolicy": "Windows packages are built from the signed release commit. Linux publication requires the frozen candidate, its provenance, an approved candidate-specific authorization and downloaded draft comparison.",
      "signedTagRequired": true,
      "productionApprovalRequired": true,
      "publicStateSource": "https://api.github.com/repos/Lotulune/Copperbench/releases/tags/v0.1.9"
    },
    "betaRelease": {
      "historical": true,
      "tag": "v0.1.0-beta.4",
      "status": "public-prerelease",
      "candidateRelease": {
        "tag": "v0.1.0-preview.8",
        "sourceCommit": "69469b8f28464469e6d917335b49b775ddb343dd",
        "assets": {
          "exe": {"name": "Copperbench.0.1.0.Windows.64bit.exe", "sha256": "660a01351e91f70286b632de896a5581545a3eef3b45d3b564227cfc962f7206"},
          "zip": {"name": "Copperbench.0.1.0.Windows.64bit.zip", "sha256": "c0c8081a6f0b019914c9a28e0d5ab2c5ba74a347921a1cf591dd87fc6e228fcc"},
          "msix": {"name": "Copperbench.0.1.0.Windows.64bit.msix", "sha256": "3aedbcbdd23a1c9cb171f10cb25ec42a61c64e314f0f0d46c30b76bb3b3ccf36"},
          "sbom": {"name": "copperbench.spdx.json", "sha256": "2149c06e5f7ed112ee8a40098ffad5b8a67b843354946594fbd9a6867f43442b"}
        }
      }
    },
    "fastCi": {
      "status": "passed",
      "run": "https://github.com/Lotulune/Copperbench/actions/runs/36351384541",
      "latestAttempt": {
        "status": "passed",
        "run": "https://github.com/Lotulune/Copperbench/actions/runs/36351384541",
        "reason": "Release main 410e11b9 passed Java/Javadoc, UI contract/build/smoke, status/docs and MCP conformance. Both protected publication workflows succeeded. Full nightly product regression and all eight generator golden jobs passed on implementation main 9bc6d104."
      },
      "runs": [
        "https://github.com/Lotulune/Copperbench/actions/runs/33515069964",
        "https://github.com/Lotulune/Copperbench/actions/runs/33527164779",
        "https://github.com/Lotulune/Copperbench/actions/runs/33528964018",
        "https://github.com/Lotulune/Copperbench/actions/runs/33676088550",
        "https://github.com/Lotulune/Copperbench/actions/runs/33696803966",
        "https://github.com/Lotulune/Copperbench/actions/runs/33704752654",
        "https://github.com/Lotulune/Copperbench/actions/runs/36269845361",
        "https://github.com/Lotulune/Copperbench/actions/runs/36321809512",
        "https://github.com/Lotulune/Copperbench/actions/runs/36351384541"
      ],
      "consecutiveGreenMainRuns": 3,
      "consecutiveGreenTarget": 3,
      "requiredChecks": [
        "Java tests and Javadoc",
        "UI contract, build, and smoke tests",
        "MCP conformance"
      ]
    },
    "nightly": {
      "status": "passed",
      "workflow": ".github/workflows/nightly.yml",
      "run": "https://github.com/Lotulune/Copperbench/actions/runs/36345702831",
      "sourceCommit": "9bc6d104688c24512468880abdc2a96828fcaab8",
      "productRegression": "passed: full Java/Javadoc/scale, full Chromium, UI contract/build, status/docs and MCP",
      "generatorGolden": "8/8 passed",
      "evidence": "evidence/maintenance/2026-09-28/publication-0.1.2/current-nightly.json",
      "previousRun": {
        "status": "failed",
        "workflow": ".github/workflows/nightly.yml",
        "run": "https://github.com/Lotulune/Copperbench/actions/runs/36265473220",
        "sourceCommit": "b813e6cf19cbc0af43b645608e0d7dc5d7e0f243",
        "productRegression": "failed: Blockbench import-panel continuity; 189 passed, 1 failed",